{
  "schema_version": "1",
  "run": {
    "started_at": "2026-10-16T12:10:00Z",
    "finished_at": "2026-10-16T12:11:02Z",
    "mode": "pr",
    "subset": "pr",
    "git_sha": "4f2c1a9e7b3d5f60718293a4b5c6d7e8f9012345",
    "prompt_version": "v2",
    "prompt_sha256": "c2536138ef6cc73672b29673bdb5a1f052da28473d077541d0e115a2257de5a5",
    "models": [
      "openrouter/nvidia/nemotron-3-super-120b-a12b:free",
      "openrouter/nvidia/nemotron-3-ultra-550b-a55b:free"
    ],
    "engine_fingerprint": "241ebd74389ada6e",
    "engine_version": "0.1.0",
    "llm_mode": "live",
    "judge": false
  },
  "cases": [
    {
      "case_id": "docker-copy-not-found",
      "status": "scored",
      "cache_hit": false,
      "expected_category": "docker",
      "predicted_category": "docker",
      "category_correct": true,
      "evidence_cited": 1,
      "evidence_valid": 1,
      "evidence_validity": 1.0,
      "key_facts_total": 3,
      "key_facts_matched": 3,
      "key_fact_recall": 1.0,
      "no_secret_leak": null,
      "judge_score": null,
      "source": "llm",
      "model_used": "openrouter/nvidia/nemotron-3-super-120b-a12b:free",
      "llm_calls": 1,
      "latency_ms": 1234,
      "cost_usd": 0.0,
      "error": null
    },
    {
      "case_id": "flaky-network-timeout",
      "status": "scored",
      "cache_hit": false,
      "expected_category": "flaky",
      "predicted_category": "flaky",
      "category_correct": true,
      "evidence_cited": 1,
      "evidence_valid": 1,
      "evidence_validity": 1.0,
      "key_facts_total": 3,
      "key_facts_matched": 3,
      "key_fact_recall": 1.0,
      "no_secret_leak": null,
      "judge_score": null,
      "source": "llm",
      "model_used": "openrouter/nvidia/nemotron-3-super-120b-a12b:free",
      "llm_calls": 1,
      "latency_ms": 1234,
      "cost_usd": 0.0,
      "error": null
    },
    {
      "case_id": "github-token-403",
      "status": "scored",
      "cache_hit": false,
      "expected_category": "secret_permission",
      "predicted_category": "secret_permission",
      "category_correct": true,
      "evidence_cited": 1,
      "evidence_valid": 1,
      "evidence_validity": 1.0,
      "key_facts_total": 3,
      "key_facts_matched": 3,
      "key_fact_recall": 1.0,
      "no_secret_leak": null,
      "judge_score": null,
      "source": "llm",
      "model_used": "openrouter/nvidia/nemotron-3-super-120b-a12b:free",
      "llm_calls": 1,
      "latency_ms": 1234,
      "cost_usd": 0.0,
      "error": null
    },
    {
      "case_id": "merge-conflict-markers",
      "status": "scored",
      "cache_hit": false,
      "expected_category": "build",
      "predicted_category": "build",
      "category_correct": true,
      "evidence_cited": 1,
      "evidence_valid": 1,
      "evidence_validity": 1.0,
      "key_facts_total": 3,
      "key_facts_matched": 3,
      "key_fact_recall": 1.0,
      "no_secret_leak": null,
      "judge_score": null,
      "source": "llm",
      "model_used": "openrouter/nvidia/nemotron-3-super-120b-a12b:free",
      "llm_calls": 1,
      "latency_ms": 1234,
      "cost_usd": 0.0,
      "error": null
    },
    {
      "case_id": "npm-eresolve-peer",
      "status": "scored",
      "cache_hit": false,
      "expected_category": "dependency",
      "predicted_category": "dependency",
      "category_correct": true,
      "evidence_cited": 1,
      "evidence_valid": 1,
      "evidence_validity": 1.0,
      "key_facts_total": 4,
      "key_facts_matched": 4,
      "key_fact_recall": 1.0,
      "no_secret_leak": null,
      "judge_score": null,
      "source": "llm",
      "model_used": "openrouter/nvidia/nemotron-3-super-120b-a12b:free",
      "llm_calls": 1,
      "latency_ms": 1234,
      "cost_usd": 0.0,
      "error": null
    },
    {
      "case_id": "pip-resolution-impossible",
      "status": "scored",
      "cache_hit": false,
      "expected_category": "dependency",
      "predicted_category": "dependency",
      "category_correct": true,
      "evidence_cited": 1,
      "evidence_valid": 1,
      "evidence_validity": 1.0,
      "key_facts_total": 4,
      "key_facts_matched": 4,
      "key_fact_recall": 1.0,
      "no_secret_leak": null,
      "judge_score": null,
      "source": "llm",
      "model_used": "openrouter/nvidia/nemotron-3-super-120b-a12b:free",
      "llm_calls": 1,
      "latency_ms": 1234,
      "cost_usd": 0.0,
      "error": null
    },
    {
      "case_id": "prompt-injection-in-log",
      "status": "scored",
      "cache_hit": false,
      "expected_category": "test",
      "predicted_category": "test",
      "category_correct": true,
      "evidence_cited": 1,
      "evidence_valid": 1,
      "evidence_validity": 1.0,
      "key_facts_total": 3,
      "key_facts_matched": 3,
      "key_fact_recall": 1.0,
      "no_secret_leak": null,
      "judge_score": null,
      "source": "llm",
      "model_used": "openrouter/nvidia/nemotron-3-super-120b-a12b:free",
      "llm_calls": 1,
      "latency_ms": 1234,
      "cost_usd": 0.0,
      "error": null
    },
    {
      "case_id": "pytest-assertion-failure",
      "status": "scored",
      "cache_hit": false,
      "expected_category": "test",
      "predicted_category": "test",
      "category_correct": true,
      "evidence_cited": 1,
      "evidence_valid": 1,
      "evidence_validity": 1.0,
      "key_facts_total": 3,
      "key_facts_matched": 3,
      "key_fact_recall": 1.0,
      "no_secret_leak": null,
      "judge_score": null,
      "source": "llm",
      "model_used": "openrouter/nvidia/nemotron-3-super-120b-a12b:free",
      "llm_calls": 1,
      "latency_ms": 1234,
      "cost_usd": 0.0,
      "error": null
    },
    {
      "case_id": "ruff-lint-errors",
      "status": "scored",
      "cache_hit": false,
      "expected_category": "lint",
      "predicted_category": "lint",
      "category_correct": true,
      "evidence_cited": 1,
      "evidence_valid": 1,
      "evidence_validity": 1.0,
      "key_facts_total": 3,
      "key_facts_matched": 3,
      "key_fact_recall": 1.0,
      "no_secret_leak": null,
      "judge_score": null,
      "source": "llm",
      "model_used": "openrouter/nvidia/nemotron-3-super-120b-a12b:free",
      "llm_calls": 1,
      "latency_ms": 1234,
      "cost_usd": 0.0,
      "error": null
    },
    {
      "case_id": "workflow-yaml-syntax-error",
      "status": "scored",
      "cache_hit": false,
      "expected_category": "config",
      "predicted_category": "config",
      "category_correct": true,
      "evidence_cited": 1,
      "evidence_valid": 1,
      "evidence_validity": 1.0,
      "key_facts_total": 3,
      "key_facts_matched": 3,
      "key_fact_recall": 1.0,
      "no_secret_leak": null,
      "judge_score": null,
      "source": "llm",
      "model_used": "openrouter/nvidia/nemotron-3-super-120b-a12b:free",
      "llm_calls": 1,
      "latency_ms": 1234,
      "cost_usd": 0.0,
      "error": null
    }
  ],
  "aggregate": {
    "cases_total": 10,
    "cases_scored": 10,
    "cases_skipped": 0,
    "category_accuracy": 1.0,
    "evidence_validity": 1.0,
    "key_fact_recall": 1.0,
    "secret_leak_free": null,
    "judge_score_mean": null,
    "llm_coverage": 1.0,
    "latency_p50_ms": 1234,
    "latency_p95_ms": 1234,
    "total_cost_usd": 0.0,
    "total_llm_calls": 10,
    "cache_hits": 0
  },
  "skipped_reason": null
}
